name,description,date,location,Image
Hackers 2 Hackers Conference (H2HC),"Hackers 2 Hackers Conference (H2HC) is a conference organized by people who work or who are directly involved in research and development in information security area, whose main objective is to enable the dissemination, discussion and the exchange of knowledge about information security between participants and also between companies involved in the event. With training and lectures presented by respected members of the corporate world, research groups and underground community, this year's conference promises to demonstrate techniques that have never been seen or discussed with the public before. And why hold a conference where they can be demonstrated new techniques attack, new tools and points systems insecurities? Because we want to show this kind of information to the public, especially to people whose job is to protect and enhance the security of systems and make them understand better how others attack their computers. People who attack usually know several techniques and it is important that security analysts, systems auditors, and other persons responsible for security also know how to defend. As can be seen when accessing the best forums, websites and email lists about subject, find security holes is not a very difficult task. For each flaw discovered by a researcher and sent to a manufacturer, there are probably others that are already known to researchers who do not notify the manufacturer. And we believe that the best way to protect against these unknown faults is to understand deeply the problems happen and create security mechanisms to prevent failures class, not just apply patches published by the manufacturer and expect anyone attack your system with 0day.",9/10/2015,"São Paulo, Brazil",
SOURCE Conference,"SOURCE Conference is now accepting submissions for SOURCE Boston 2015. This is your opportunity to communicate your research, knowledge and expertise to top security professionals, advanced IT professionals, senior and top-level executives, company chief officers (e.g. CTOs, CISOs), faculty and students from colleges and universities and members of management and business communities.",9/10/2015,"Boston, Massachusetts, United States",
HITBSecConf / Hack In The Box,"HITBSecConf or the Hack In The Box Security Conference is an annual must attend event in the calendars of security researchers and professionals around the world. Held annually in Kuala Lumpur, Malaysia and Amsterdam in The Netherlands, HITBSecConf is a platform for the discussion and dissemination of next generation computer security issues. Our events routinely feature two days of trainings and a two-day multi-track conference featuring cutting-edge hardcore technical talks delivered by some of the most respected names in the computer security industry. HITBSecConf is a place where ideas are exchanged, talent discovered and genius celebrated.",9/10/2015,"Amsterdam, The Netherlands",http://conference.hitb.nl/
INFWARCON Beyond Information Warfare,"InfowarCon 15 again plans to unite a highly culled group of political, military, academic, DIYer, and commercial cyber-leaders and thinkers from around the world to examine the current, future, and potential hostile use of cyber and related information technologies and how to neutralize the current ones. We encourage government, law enforcement, academia, corporations, product vendors, and individuals from all nations to submit papers, presentations, demonstrations, and concepts for presentations to be given at InfowarCon 15 and subsequently published.",9/10/2015,"Nashville, Tennessee, United States",
T2 infosec conference,"t2 was born at a time when there was a need for a conference that was “from hacker to hacker” when there was not one single independent, technically oriented, information security conference in Finland in existence. The mission of t2 has remained the same from its commencement, to be an annual conference dedicated to those who are interested in the technical aspects of information security. t2 offers the opportunity to publish new research and ideas as well as networking, the latter an elemental part of its ideology.",9/10/2015,"Helsinki, Finland",
Virus Bulletin conference,"Over its 24-year history, the VB conference has become a major highlight of the IT security calendar, with many of its regular attendees citing it as the security event of the year. The conference provides a focus for the industry, representing an opportunity for experts in the field to share their research interests, discuss methods and technologies and set new standards, as well as meet with - and learn from - those who put their technologies into practice in the real world. The conference program caters for both technical and corporate audiences, covering a wide range of security-related subjects. Delegates range from dedicated threat researchers working independently or within vendor companies, to IT security experts from government and military organizations, legal, financial and educational institutions and large corporations worldwide.",9/10/2015,"Prague, Czech Republic",https://upload.wikimedia.org/wikipedia/commons/a/a2/VirusBulletin.png